{
  "contract_id": "contract:Routestra:waste-stack:live-probe",
  "decision": "PASS",
  "executed_at": "2026-07-16T00:00:00Z",
  "machine_evidence_sha256s": [
    "8e6d88d11ec209680bbcbea99ce0ac6a82b8b037ab8f98dfe197c5bf7bc428b9"
  ],
  "observations": {
    "case_count": 1,
    "contract_sha256": "57bf2ceed6354c4168e226c64a1774c09d43517480f2430a93cc573b54adb98e",
    "matched_machines": [
      "M10"
    ],
    "probe_cases": [
      "Routestra:waste-stack:bound"
    ]
  },
  "problems": [],
  "receipt_id": "receipt:Routestra:waste-stack:live-probe",
  "receipt_sha256": "098db42954373ae782bc4443d24cd7f87d1a1f62767e3cbe662b5cb4a1ab68cb",
  "runner": "helix-parity-pending-promotion/1.0",
  "schema": "helix-parity-receipt/1.0",
  "source_lock_sha256s": [
    "9bb944e56f316fc09280c460e1c98652f7fd7024c7b9702fedff542aa2be005f"
  ]
}
